{
  "version": 1,
  "revision": 8,
  "minAppVersion": "0.3.5",
  "definitions": [
    {
      "id": "project-display",
      "title": "Sidebar",
      "group": "Appearance",
      "description": "Choose what appears in your sidebar and how it is organized.",
      "match": {
        "paths": [
          "nextprob.config.json"
        ]
      },
      "format": "json",
      "views": [
        "structured",
        "source"
      ],
      "creation": {
        "mode": "explicit",
        "initialText": "{\n  \"version\": 1\n}\n"
      },
      "schema": "project-config.schema.json",
      "ui": {
        "defaultView": "structured",
        "order": 0,
        "layout": [
          {
            "type": "group",
            "title": "General",
            "children": [
              {
                "type": "field",
                "path": [
                  "surfaces",
                  "sidebar",
                  "hideDotFolders"
                ],
                "title": "Hide files and folders starting with “.”",
                "control": "toggle",
                "default": true,
                "description": "Keep hidden project files out of folder views."
              }
            ]
          },
          {
            "type": "list",
            "path": [
              "surfaces",
              "sidebar",
              "sections"
            ],
            "title": "Sections",
            "description": "Expand a section to change its name, layout, or sorting. Move sections to set their order.",
            "default": [
              {
                "id": "favorites",
                "title": "Favorites",
                "view": "list",
                "collection": "favorites",
                "hideWhenEmpty": true
              },
              {
                "id": "files",
                "title": "Probs",
                "view": "tree",
                "source": "items"
              }
            ],
            "itemTitle": [
              "title"
            ],
            "keyField": "id",
            "reorderable": true,
            "removable": true,
            "itemTemplate": {
              "id": "section",
              "title": "New section",
              "view": "list",
              "source": "notes"
            },
            "addLabel": "+ Add section",
            "children": [
              {
                "type": "field",
                "path": [
                  "enabled"
                ],
                "title": "Show section",
                "control": "toggle",
                "default": true,
                "summary": true
              },
              {
                "type": "field",
                "path": [
                  "title"
                ],
                "title": "Section name"
              },
              {
                "type": "field",
                "path": [
                  "view"
                ],
                "title": "Display as",
                "control": "select",
                "options": [
                  {
                    "value": "list",
                    "label": "List"
                  },
                  {
                    "value": "tree",
                    "label": "Folder tree"
                  }
                ],
                "clearOnChange": [
                  [
                    "hiddenFolders"
                  ],
                  [
                    "hiddenFiles"
                  ],
                  [
                    "shownFolders"
                  ],
                  [
                    "shownFiles"
                  ]
                ]
              },
              {
                "type": "field",
                "path": [
                  "sort"
                ],
                "title": "Sort by",
                "control": "select",
                "options": [
                  {
                    "value": "title",
                    "label": "Title"
                  },
                  {
                    "value": "name",
                    "label": "Name"
                  },
                  {
                    "value": "path",
                    "label": "File path"
                  },
                  {
                    "value": "modifiedAt",
                    "label": "Last modified"
                  },
                  {
                    "value": "favoriteOrder",
                    "label": "My favorites order"
                  }
                ],
                "optional": true,
                "emptyLabel": "Use collection order / name"
              },
              {
                "type": "group",
                "title": "More options",
                "children": [
                  {
                    "type": "field",
                    "path": [
                      "hideWhenEmpty"
                    ],
                    "title": "Hide when empty",
                    "control": "toggle",
                    "default": false
                  },
                  {
                    "type": "field",
                    "path": [
                      "hiddenFolders"
                    ],
                    "title": "Excluded folders",
                    "control": "lines",
                    "visibleWhen": {
                      "path": [
                        "view"
                      ],
                      "equals": "tree"
                    },
                    "description": "One project-relative folder per line. Add or remove entries to customize this list."
                  },
                  {
                    "type": "field",
                    "path": [
                      "hiddenFiles"
                    ],
                    "title": "Excluded files",
                    "control": "lines",
                    "visibleWhen": {
                      "path": [
                        "view"
                      ],
                      "equals": "tree"
                    },
                    "description": "One filename (any depth) or project-relative file path per line. Add or remove entries to customize this list. Case-sensitive; no wildcards."
                  },
                  {
                    "type": "group",
                    "title": "Content selection",
                    "children": [
                      {
                        "type": "field",
                        "path": [
                          "source"
                        ],
                        "title": "Include",
                        "control": "select",
                        "options": [
                          {
                            "value": "items",
                            "label": "All files and notes"
                          },
                          {
                            "value": "notes",
                            "label": "Notes only"
                          }
                        ],
                        "emptyLabel": "Use a collection",
                        "clearOnChange": [
                          [
                            "collection"
                          ]
                        ]
                      },
                      {
                        "type": "field",
                        "path": [
                          "collection"
                        ],
                        "title": "Collection",
                        "control": "select",
                        "optionsFrom": [
                          "collections"
                        ],
                        "emptyLabel": "Use the selection above",
                        "clearOnChange": [
                          [
                            "source"
                          ]
                        ]
                      },
                      {
                        "type": "field",
                        "path": [
                          "id"
                        ],
                        "title": "Section ID",
                        "description": "Keep this stable to preserve saved section preferences."
                      }
                    ],
                    "collapsed": true
                  }
                ],
                "collapsed": true
              }
            ]
          },
          {
            "type": "group",
            "title": "Advanced",
            "children": [
              {
                "type": "map",
                "path": [
                  "collections"
                ],
                "title": "Custom collections",
                "description": "Reusable selections of files and notes. Section references use these names; update references before removing a collection.",
                "default": {
                  "favorites": {
                    "source": "items",
                    "where": {
                      "===": [
                        {
                          "var": "favorite"
                        },
                        true
                      ]
                    },
                    "sort": "favoriteOrder"
                  }
                },
                "mergeDefaults": true,
                "removable": false,
                "itemTemplate": {
                  "source": "notes"
                },
                "addLabel": "+ Add collection",
                "children": [
                  {
                    "type": "field",
                    "path": [
                      "source"
                    ],
                    "title": "Include",
                    "control": "select",
                    "options": [
                      {
                        "value": "items",
                        "label": "All files and notes"
                      },
                      {
                        "value": "notes",
                        "label": "Notes only"
                      }